{
 "schema": "codestory.storyboard/1",
 "title": "Daily weather pipeline",
 "subtitle": "Raw sensor readings become a cleaned daily summary per station, a report, a database table and an alert.",
 "mode": "run",
 "entry": "main.py --date 2026-10-01 --full-refresh",
 "run": {
  "status": "ok",
  "started_at": "2026-10-03T21:02:08+00:00",
  "duration_ms": 619.4,
  "args": [
   "--date",
   "2026-10-01",
   "--full-refresh"
  ],
  "safe_mode": true
 },
 "scenes": [
  {
   "id": "imports",
   "phase": "imports",
   "title": "Bring in the tools",
   "narration": "The pipeline loads three packages for data, numbers and web requests, a few of Python's built-in modules, and five files of its own.",
   "items": [
    {
     "label": "pandas",
     "kind": "third_party",
     "note": "tables"
    },
    {
     "label": "numpy",
     "kind": "third_party",
     "note": "math"
    },
    {
     "label": "requests",
     "kind": "third_party",
     "note": "web calls"
    },
    {
     "label": "argparse",
     "kind": "stdlib"
    },
    {
     "label": "logging",
     "kind": "stdlib"
    },
    {
     "label": "datetime",
     "kind": "stdlib"
    },
    {
     "label": "sqlite3",
     "kind": "stdlib"
    },
    {
     "label": "os",
     "kind": "stdlib"
    },
    {
     "label": "config",
     "kind": "project"
    },
    {
     "label": "etl.extract",
     "kind": "project"
    },
    {
     "label": "etl.clean",
     "kind": "project"
    },
    {
     "label": "etl.transform",
     "kind": "project"
    },
    {
     "label": "etl.load",
     "kind": "project"
    }
   ]
  },
  {
   "id": "constants",
   "phase": "constants",
   "title": "Read the settings",
   "narration": "config.py fixes where data lives and the limits used later: temperatures outside −40 to 55 °C are impossible, and a station is unusual when it sits 1.4 standard deviations from its region.",
   "items": [
    {
     "label": "INPUT_CSV",
     "value": "data/readings.csv",
     "kind": "constant"
    },
    {
     "label": "STATIONS_DB",
     "value": "data/stations.db",
     "kind": "constant"
    },
    {
     "label": "OUTPUT_DIR",
     "value": "output",
     "kind": "constant"
    },
    {
     "label": "MIN_TEMP_C",
     "value": "-40.0",
     "kind": "constant"
    },
    {
     "label": "MAX_TEMP_C",
     "value": "55.0",
     "kind": "constant"
    },
    {
     "label": "ANOMALY_Z",
     "value": "1.4",
     "kind": "constant"
    },
    {
     "label": "ALERT_WEBHOOK",
     "value": "hooks.example.com/weather-alerts",
     "kind": "config",
     "note": "default; env var not set"
    },
    {
     "label": "API_TOKEN",
     "value": "••••••",
     "kind": "secret"
    }
   ]
  },
  {
   "id": "args",
   "phase": "setup",
   "title": "Read the command line",
   "narration": "main() starts by reading its options. This run is for 1 October 2026 and asks for a full refresh of the database table.",
   "inputs": [
    {
     "kind": "config",
     "label": "Command line",
     "sublabel": "--date 2026-10-01 --full-refresh"
    }
   ],
   "actor": {
    "kind": "function",
    "label": "parse_args()",
    "sublabel": "main.py",
    "code": {
     "file": "main.py",
     "line": 16,
     "snippet": "def parse_args():\n    p = argparse.ArgumentParser()\n    p.add_argument(\"--date\", default=str(date.today()))\n    p.add_argument(\"--full-refresh\", action=\"store_true\")\n    p.add_argument(\"--no-alerts\", action=\"store_true\")\n    return p.parse_args()",
     "highlight": [
      16,
      21
     ]
    }
   },
   "outputs": [
    {
     "kind": "config",
     "label": "Options",
     "sublabel": "date 2026-10-01, full refresh on, alerts on"
    }
   ]
  },
  {
   "id": "read-readings",
   "phase": "input",
   "title": "Load the sensor readings",
   "narration": "Every reading from the daily CSV drop is loaded into a table: 601 rows of station, time, temperature and unit.",
   "inputs": [
    {
     "kind": "file",
     "label": "readings.csv",
     "sublabel": "data/readings.csv"
    }
   ],
   "actor": {
    "kind": "function",
    "label": "read_readings()",
    "sublabel": "etl/extract.py",
    "code": {
     "file": "etl/extract.py",
     "line": 5,
     "snippet": "def read_readings(path):\n    \"\"\"Load raw sensor readings from the daily CSV drop.\"\"\"\n    df = pd.read_csv(path, parse_dates=[\"timestamp\"])\n    return df",
     "highlight": [
      7
     ]
    }
   },
   "outputs": [
    {
     "kind": "data",
     "label": "raw",
     "data": {
      "rows": 601,
      "cols": 4,
      "columns": [
       "station_id",
       "timestamp",
       "temp",
       "unit"
      ],
      "sample": {
       "columns": [
        "station_id",
        "timestamp",
        "temp",
        "unit"
       ],
       "rows": [
        [
         "ST09",
         "2026-09-30 18:00:00",
         "26.2",
         "C"
        ],
        [
         "ST01",
         "2026-09-30 07:00:00",
         "5.5",
         "C"
        ],
        [
         "ST07",
         "2026-09-30 04:00:00",
         "17.1",
         "C"
        ]
       ]
      }
     }
    }
   ]
  },
  {
   "id": "load-stations",
   "phase": "input",
   "title": "Look up the stations",
   "narration": "Station names, regions and elevations come from a SQLite database. Safe mode opened a working copy, so the real file was never touched.",
   "inputs": [
    {
     "kind": "database",
     "label": "stations",
     "sublabel": "data/stations.db",
     "status": "sandboxed",
     "detail": "Opened as a working copy in the sandbox."
    }
   ],
   "actor": {
    "kind": "function",
    "label": "load_stations()",
    "sublabel": "etl/extract.py",
    "code": {
     "file": "etl/extract.py",
     "line": 11,
     "snippet": "def load_stations(db_path):\n    \"\"\"Fetch station metadata (name, region, elevation).\"\"\"\n    with sqlite3.connect(db_path) as conn:\n        return pd.read_sql_query(\"SELECT station_id, name, region, elevation_m FROM stations\", conn)",
     "highlight": [
      14
     ]
    }
   },
   "outputs": [
    {
     "kind": "data",
     "label": "stations",
     "data": {
      "rows": 12,
      "cols": 4,
      "columns": [
       "station_id",
       "name",
       "region",
       "elevation_m"
      ],
      "sample": {
       "columns": [
        "station_id",
        "name",
        "region",
        "elevation_m"
       ],
       "rows": [
        [
         "ST01",
         "Ridge Point",
         "North",
         "820"
        ],
        [
         "ST02",
         "Lakeside",
         "North",
         "210"
        ],
        [
         "ST03",
         "Old Mill",
         "North",
         "340"
        ]
       ]
      }
     }
    }
   ]
  },
  {
   "id": "clean",
   "phase": "transform",
   "title": "Clean the readings",
   "narration": "Three cleaning steps run in order. Together they remove 49 rows, leaving 552 trustworthy readings.",
   "inputs": [
    {
     "kind": "data",
     "label": "raw",
     "data": {
      "rows": 601,
      "cols": 4,
      "columns": [
       "station_id",
       "timestamp",
       "temp",
       "unit"
      ],
      "sample": {
       "columns": [
        "station_id",
        "timestamp",
        "temp",
        "unit"
       ],
       "rows": [
        [
         "ST09",
         "2026-09-30 18:00:00",
         "26.2",
         "C"
        ],
        [
         "ST01",
         "2026-09-30 07:00:00",
         "5.5",
         "C"
        ],
        [
         "ST07",
         "2026-09-30 04:00:00",
         "17.1",
         "C"
        ]
       ]
      }
     }
    }
   ],
   "actor": {
    "kind": "function",
    "label": "clean()",
    "sublabel": "etl/clean.py",
    "code": {
     "file": "etl/clean.py",
     "line": 24,
     "snippet": "def clean(df):\n    for step in (to_celsius, drop_invalid, dedupe):\n        df = step(df)\n    return df",
     "highlight": [
      25,
      26
     ]
    }
   },
   "outputs": [
    {
     "kind": "data",
     "label": "readings",
     "data": {
      "rows": 552,
      "cols": 4,
      "columns": [
       "station_id",
       "timestamp",
       "temp",
       "unit"
      ],
      "sample": {
       "columns": [
        "station_id",
        "timestamp",
        "temp",
        "unit"
       ],
       "rows": [
        [
         "ST09",
         "2026-09-30 18:00:00",
         "26.2",
         "C"
        ],
        [
         "ST01",
         "2026-09-30 07:00:00",
         "5.5",
         "C"
        ],
        [
         "ST07",
         "2026-09-30 04:00:00",
         "17.1",
         "C"
        ]
       ]
      }
     }
    }
   ],
   "stats": [
    {
     "label": "Rows in",
     "value": 601
    },
    {
     "label": "Rows kept",
     "value": 552,
     "delta": -49
    }
   ],
   "children": [
    {
     "id": "to-celsius",
     "phase": "transform",
     "title": "Convert Fahrenheit to Celsius",
     "narration": "Two coastal stations report in Fahrenheit. Their values are converted so every row uses Celsius. No rows are removed.",
     "inputs": [
      {
       "kind": "data",
       "label": "raw",
       "data": {
        "rows": 601,
        "cols": 4,
        "columns": [
         "station_id",
         "timestamp",
         "temp",
         "unit"
        ],
        "sample": {
         "columns": [
          "station_id",
          "timestamp",
          "temp",
          "unit"
         ],
         "rows": [
          [
           "ST09",
           "2026-09-30 18:00:00",
           "26.2",
           "C"
          ],
          [
           "ST01",
           "2026-09-30 07:00:00",
           "5.5",
           "C"
          ],
          [
           "ST07",
           "2026-09-30 04:00:00",
           "17.1",
           "C"
          ]
         ]
        }
       }
      }
     ],
     "actor": {
      "kind": "function",
      "label": "to_celsius()",
      "sublabel": "etl/clean.py",
      "code": {
       "file": "etl/clean.py",